{
  "compatibility": {
    "supported_contract_versions": [
      "five-layer-workload.v2",
      "resolved-deployment-specification.v2"
    ],
    "provider_implementation_schema_versions": [
      "provider-implementation-profile.v2"
    ],
    "catalog_schema_versions": [
      "deployment-component-catalog.v2"
    ],
    "resolved_architecture_schema_versions": [
      "resolved-twin-architecture.v2"
    ]
  },
  "components": [
    {
      "component_id": "component.archive-storage",
      "component_kind": "storage",
      "cost_owner_ids": [
        "cost.archive-storage"
      ],
      "extension_slot_ids": [],
      "input_port_ids": [
        "port.archive-storage.write-in"
      ],
      "observability_contract_id": "observability.baseline",
      "output_port_ids": [],
      "required": true,
      "required_capability_ids": [
        "capability.archive-storage"
      ],
      "responsibility_id": "responsibility.storage"
    },
    {
      "component_id": "component.cool-storage",
      "component_kind": "storage",
      "cost_owner_ids": [
        "cost.cool-storage"
      ],
      "extension_slot_ids": [],
      "input_port_ids": [
        "port.cool-storage.write-in"
      ],
      "observability_contract_id": "observability.baseline",
      "output_port_ids": [
        "port.cool-storage.transition-out"
      ],
      "required": true,
      "required_capability_ids": [
        "capability.cool-storage"
      ],
      "responsibility_id": "responsibility.storage"
    },
    {
      "component_id": "component.hot-storage",
      "component_kind": "storage",
      "cost_owner_ids": [
        "cost.hot-storage"
      ],
      "extension_slot_ids": [],
      "input_port_ids": [
        "port.hot-storage.processing-event-in",
        "port.hot-storage.command-outcome-event-in"
      ],
      "observability_contract_id": "observability.baseline",
      "output_port_ids": [
        "port.hot-storage.transition-out",
        "port.hot-storage.twin-projection-out",
        "port.hot-storage.raw-history-out"
      ],
      "required": true,
      "required_capability_ids": [
        "capability.hot-storage"
      ],
      "responsibility_id": "responsibility.storage"
    },
    {
      "component_id": "component.ingestion",
      "component_kind": "ingress",
      "cost_owner_ids": [
        "cost.ingestion"
      ],
      "extension_slot_ids": [],
      "input_port_ids": [
        "port.ingestion.device-command-in"
      ],
      "observability_contract_id": "observability.baseline",
      "output_port_ids": [
        "port.ingestion.telemetry-event-out",
        "port.ingestion.command-outcome-event-out"
      ],
      "required": true,
      "required_capability_ids": [
        "capability.ingestion",
        "capability.embedded-domain-event-ingress"
      ],
      "responsibility_id": "responsibility.ingestion"
    },
    {
      "component_id": "component.processing",
      "component_kind": "processor",
      "cost_owner_ids": [
        "cost.processing"
      ],
      "extension_slot_ids": [
        "processor.telemetry"
      ],
      "input_port_ids": [
        "port.processing.telemetry-event-in"
      ],
      "observability_contract_id": "observability.baseline",
      "output_port_ids": [
        "port.processing.persistence-event-out",
        "port.processing.device-command-out"
      ],
      "required": true,
      "required_capability_ids": [
        "capability.processing",
        "capability.embedded-domain-event-routing",
        "capability.mandatory-rule-action-feedback"
      ],
      "responsibility_id": "responsibility.processing"
    },
    {
      "component_id": "component.twin-state",
      "component_kind": "twin_state",
      "cost_owner_ids": [
        "cost.twin-state"
      ],
      "extension_slot_ids": [],
      "input_port_ids": [
        "port.twin-state.projection-in"
      ],
      "observability_contract_id": "observability.baseline",
      "output_port_ids": [],
      "required": true,
      "required_capability_ids": [
        "capability.twin-state"
      ],
      "responsibility_id": "responsibility.twin-state"
    },
    {
      "component_id": "component.visualization",
      "component_kind": "visualization",
      "cost_owner_ids": [
        "cost.visualization"
      ],
      "extension_slot_ids": [],
      "input_port_ids": [
        "port.visualization.raw-history-in"
      ],
      "observability_contract_id": "observability.baseline",
      "output_port_ids": [],
      "required": true,
      "required_capability_ids": [
        "capability.visualization"
      ],
      "responsibility_id": "responsibility.visualization"
    }
  ],
  "content_digest": "sha256:36a68644e66be0b7242d692b9a75fd8d99173a28b00b00fa110023693dc5e854",
  "description": "Functionally complete thesis-PoC profile with mandatory embedded domain events, provider-local L3-hot/L5 raw history, and an independently placeable L4 Twin.",
  "display_name": "Five-layer baseline v2",
  "edges": [
    {
      "cost_owner_ids": [
        "cost.cool-to-archive-storage"
      ],
      "delivery_requirements": {
        "dead_letter_policy": "provider_managed",
        "idempotency": "consumer_deduplicated",
        "mode": "asynchronous",
        "ordering": "per_entity",
        "replay": "bounded",
        "retry_policy": "provider_managed_bounded",
        "timeout_policy": "not_applicable"
      },
      "destination_component_id": "component.archive-storage",
      "destination_port_id": "port.archive-storage.write-in",
      "edge_contract_id": "storage_transition.v1",
      "edge_contract_version": "1",
      "edge_id": "edge.cool-to-archive-storage",
      "observability_requirements": {
        "bounded_error_contract": "required",
        "correlation": "required",
        "metrics": "required"
      },
      "required": true,
      "source_component_id": "component.cool-storage",
      "source_port_id": "port.cool-storage.transition-out",
      "transfer_workload_ref": {
        "id": "telemetry-update-count",
        "version": "1"
      },
      "trust_requirements": {
        "authentication": "workload_identity",
        "authorization": "least_privilege_capability_set",
        "transport": "tls"
      }
    },
    {
      "cost_owner_ids": [
        "cost.hot-storage-to-twin-state"
      ],
      "delivery_requirements": {
        "dead_letter_policy": "provider_managed",
        "idempotency": "consumer_deduplicated",
        "mode": "asynchronous",
        "ordering": "per_entity",
        "replay": "bounded",
        "retry_policy": "provider_managed_bounded",
        "timeout_policy": "not_applicable"
      },
      "destination_component_id": "component.twin-state",
      "destination_port_id": "port.twin-state.projection-in",
      "edge_contract_id": "twin_projection.v1",
      "edge_contract_version": "1",
      "edge_id": "edge.hot-storage-to-twin-state",
      "observability_requirements": {
        "bounded_error_contract": "required",
        "correlation": "required",
        "metrics": "required"
      },
      "required": true,
      "source_component_id": "component.hot-storage",
      "source_port_id": "port.hot-storage.twin-projection-out",
      "transfer_workload_ref": {
        "id": "telemetry-update-count",
        "version": "1"
      },
      "trust_requirements": {
        "authentication": "workload_identity",
        "authorization": "least_privilege_capability_set",
        "transport": "tls"
      }
    },
    {
      "cost_owner_ids": [
        "cost.hot-to-cool-storage"
      ],
      "delivery_requirements": {
        "dead_letter_policy": "provider_managed",
        "idempotency": "consumer_deduplicated",
        "mode": "asynchronous",
        "ordering": "per_entity",
        "replay": "bounded",
        "retry_policy": "provider_managed_bounded",
        "timeout_policy": "not_applicable"
      },
      "destination_component_id": "component.cool-storage",
      "destination_port_id": "port.cool-storage.write-in",
      "edge_contract_id": "storage_transition.v1",
      "edge_contract_version": "1",
      "edge_id": "edge.hot-to-cool-storage",
      "observability_requirements": {
        "bounded_error_contract": "required",
        "correlation": "required",
        "metrics": "required"
      },
      "required": true,
      "source_component_id": "component.hot-storage",
      "source_port_id": "port.hot-storage.transition-out",
      "transfer_workload_ref": {
        "id": "telemetry-update-count",
        "version": "1"
      },
      "trust_requirements": {
        "authentication": "workload_identity",
        "authorization": "least_privilege_capability_set",
        "transport": "tls"
      }
    },
    {
      "cost_owner_ids": [
        "cost.ingestion-to-processing"
      ],
      "delivery_requirements": {
        "dead_letter_policy": "provider_managed",
        "idempotency": "consumer_deduplicated",
        "mode": "asynchronous",
        "ordering": "per_entity",
        "replay": "bounded",
        "retry_policy": "provider_managed_bounded",
        "timeout_policy": "not_applicable"
      },
      "destination_component_id": "component.processing",
      "destination_port_id": "port.processing.telemetry-event-in",
      "edge_contract_id": "canonical-domain-event.v1",
      "edge_contract_version": "1",
      "edge_id": "edge.ingestion-to-processing",
      "observability_requirements": {
        "bounded_error_contract": "required",
        "correlation": "required",
        "metrics": "required"
      },
      "required": true,
      "source_component_id": "component.ingestion",
      "source_port_id": "port.ingestion.telemetry-event-out",
      "transfer_workload_ref": {
        "id": "telemetry-update-count",
        "version": "1"
      },
      "trust_requirements": {
        "authentication": "workload_identity",
        "authorization": "least_privilege_capability_set",
        "transport": "tls"
      }